{"$schema":"https://json-schema.org/draft/2020-12/schema","type":"object","additionalProperties":false,"required":["schema_version","receipt_id","request_id","request_sha256","requested_action","sku_id","result","passport_before","passport_after","accepted_source_count","rejected_source_count","duplicate_count","change_event_ids","question_ids","conflict_ids","user_message_code","external_side_effects_executed","publication_authority","evaluated_at"],"properties":{"schema_version":{"const":"1.0"},"receipt_id":{"type":"string","pattern":"^LS-PSP-RECEIPT-[A-Z0-9._-]+$"},"request_id":{"type":"string","minLength":1},"request_sha256":{"type":"string","pattern":"^[a-f0-9]{64}$"},"requested_action":{"enum":["SUBMIT_SOURCE_EVIDENCE_DELTA","RECREATE_PASSPORT"]},"sku_id":{"type":"string","minLength":1},"result":{"enum":["NO_PASSPORT_CHANGE","PASSPORT_UPDATED","DECISION_REQUIRED","WRONG_SKU_OR_SCOPE","STANDARDS_MATERIAL_ROUTED","REQUEST_REJECTED","RECREATE_ACCEPTED","RECREATE_IN_PROGRESS","RECREATE_REJECTED","RECREATE_COMMITTED","RECREATE_ROLLED_BACK"]},"passport_before":{"$ref":"#/$defs/binding"},"passport_after":{"oneOf":[{"type":"null"},{"$ref":"#/$defs/binding"}]},"accepted_source_count":{"type":"integer","minimum":0},"rejected_source_count":{"type":"integer","minimum":0},"duplicate_count":{"type":"integer","minimum":0},"change_event_ids":{"type":"array","uniqueItems":true,"items":{"type":"string"}},"question_ids":{"type":"array","uniqueItems":true,"items":{"type":"string"}},"conflict_ids":{"type":"array","uniqueItems":true,"items":{"type":"string"}},"user_message_code":{"type":"string","pattern":"^[A-Z0-9_]+$"},"external_side_effects_executed":{"type":"integer","minimum":0},"publication_authority":{"const":"NOT_GRANTED"},"evaluated_at":{"type":"string","format":"date-time"}},"$defs":{"binding":{"type":"object","additionalProperties":false,"required":["passport_id","version","sha256"],"properties":{"passport_id":{"type":"string"},"version":{"type":"string"},"sha256":{"type":"string","pattern":"^[a-f0-9]{64}$"}}}}}
